{
  "schema_version": "code_review.report.v1",
  "run_id": "RUN-ID-2026-09-14",
  "attempt_id": "A2",
  "input_manifest_digest": "sha256:2f4a2b3c4d5e6f7a8b9c0d1e2f3a4b5c6d7e8f9a0b1c2d3e4f5a6b7c8d9e0f1b",
  "impact_artifact": {
    "artifact_id": "art_impact_R1",
    "producer_id": "did:agentnexus:z6MkNexusScanner00000000000000000000000000000",
    "media_type": "application/json",
    "schema_version": "nexus.review_impact.v1",
    "digest_algorithm": "sha256-bytes-v1",
    "digest": "sha256:0123456789abcdef0123456789abcdef0123456789abcdef0123456789abcdef",
    "byte_length": 18456,
    "locator": "nexus://reports/R1/impact.json",
    "access_scope": "maintenance_domain_read",
    "retention_until": "2027-03-18T00:00:00Z",
    "replaces": null
  },
  "review_policy_sha256": "0123456789abcdef0123456789abcdef0123456789abcdef0123456789abcdef",
  "review_revision": 1,
  "base_sha": "1a2b3c4d5e6f7a8b9c0d1e2f3a4b5c6d7e8f9a0b",
  "head_sha": "2b3c4d5e6f7a8b9c0d1e2f3a4b5c6d7e8f9a0b1c",
  "target_sha": "3c4d5e6f7a8b9c0d1e2f3a4b5c6d7e8f9a0b1c2d",
  "generation": 3,
  "execution_revision": 1,
  "reviewer_id": "did:agentnexus:z6MkReviewerWorker00000000000000000000000000000",
  "coverage": {
    "status": "partial",
    "planned_files": [
      "src/main/java/com/example/OrderService.java",
      "src/main/java/com/example/OrderRepository.java"
    ],
    "reviewed_files": [
      "src/main/java/com/example/OrderService.java",
      "src/main/java/com/example/OrderRepository.java"
    ],
    "omitted_files": [],
    "gap_reasons": ["未评审目标分支之外的调用方"],
    "inherited_gaps": []
  },
  "outcome": "issues_found",
  "findings": [
    {
      "finding_id": "F1",
      "severity": "high",
      "title": "订单金额在校验前被写入",
      "trigger": "并发提交同一 orderId 且库存校验失败时",
      "impact": "库存不足的订单仍会产生待支付记录，导致超卖",
      "location": {
        "side": "after",
        "commit_sha": "2b3c4d5e6f7a8b9c0d1e2f3a4b5c6d7e8f9a0b1c",
        "path": "src/main/java/com/example/OrderService.java",
        "start_line": 88,
        "end_line": 92
      },
      "evidence_refs": [
        {
          "provider_id": "did:agentnexus:z6MkNexusScanner00000000000000000000000000000",
          "report_id": "R1",
          "side": "after",
          "snapshot_id": "snap_after_g3",
          "project": "proj_7788",
          "commit_sha": "2b3c4d5e6f7a8b9c0d1e2f3a4b5c6d7e8f9a0b1c",
          "path": "src/main/java/com/example/OrderService.java",
          "blob_sha": "e69de29bb2d1d6434b8b29ae775ad8c2e48c5391",
          "start_line": 88,
          "end_line": 92,
          "content_sha256": "5e8f9a0b1c2d3e4f5a6b7c8d9e0f1a2b3c4d5e6f7a8b9c0d1e2f3a4b5c6d7e8f"
        },
        {
          "provider_id": "did:agentnexus:z6MkNexusScanner00000000000000000000000000000",
          "report_id": "R1",
          "side": "before",
          "snapshot_id": "snap_before_g3",
          "project": "proj_7788",
          "commit_sha": "1a2b3c4d5e6f7a8b9c0d1e2f3a4b5c6d7e8f9a0b",
          "type": "relation",
          "relation": "calls",
          "relation_artifact": {
            "artifact_id": "art_impact_R1",
            "producer_id": "did:agentnexus:z6MkNexusScanner00000000000000000000000000000",
            "media_type": "application/json",
            "schema_version": "nexus.review_impact.v1",
            "digest_algorithm": "sha256-bytes-v1",
            "digest": "sha256:0123456789abcdef0123456789abcdef0123456789abcdef0123456789abcdef",
            "byte_length": 18456,
            "locator": "nexus://reports/R1/impact.json",
            "access_scope": "maintenance_domain_read",
            "retention_until": "2027-03-18T00:00:00Z",
            "replaces": null
          }
        }
      ],
      "suggested_validation": "增加并发库存校验失败的集成测试，断言不产生待支付记录"
    }
  ],
  "limitations": [],
  "execution_metadata": {
    "provider": "hczj-model-gateway",
    "model": "code-review-model",
    "model_version": "2026-07",
    "skill_version": "code-review-skill/0.1.0",
    "tool_versions": ["nexus-mcp/1.0"],
    "started_at": "2026-09-18T06:10:00Z",
    "completed_at": "2026-09-18T06:14:00Z"
  },
  "usage": {
    "measurement": "known",
    "input_tokens": 88000,
    "output_tokens": 9000,
    "cost": { "amount": 0.7, "currency": "USD" },
    "note": null
  }
}